judul,penerbit,link,tanggal,content
212165
%%EOF"
"Gojek Uji Coba Fitur GoRide Nego, Apa Itu?",kompas ,https://www.kompas.com/tren/read/2023/11/01/170000165/gojek-uji-coba-fitur-goride-nego-apa-itu-?,01/11/2023,"KOMPAS.com - Media sosial X ramai membahas soal fitur GoRide Nego yang akan diluncurkan aplikasi Gojek.

Salah satu pengguna X yang mengunggah soal tersebut adalah akun @doktermarket pada Minggu (29/10/2023).

""Busyet deh. Apa gak makin kepukul tuh ""mitra"" kalian? Pendapatan mereka berisiko makin turun,"" tulis pengunggah.

Informasi bakal diluncurkannya fitur baru tersebut memicu beragam respons sejumlah warganet sekaligus pengguna aplikasi Gojek.

Lantas, benarkah Gojek akan meluncurkan fitur GoRide Nego? Fitur apa itu?

Baca juga: Gojek Luncurkan Layanan Baru GoSend Car Instant dan GoBox Van dengan Ongkir Mulai Rp 26.000, Apa Kelebihannya?

Penjelasan Gojek

Manajemen PT GoTo Gojek Tokopedia Tbk (GoTO) melalui keterangan resminya yang diterima Kompas.com, Senin (30/10/2023) membenarkan pihaknya tengah menggodok fitur GoRide Nego.

Menurut GoTo, fitur tersebut tengah dalam tahap uji coba.

Melalui fitur GoRide Nego, konsumen dan mitra pengemudi dapat berkomunikasi secara langsung untuk menyepakati harga pengantaran.

""Ini adalah contoh inovasi Perseroan yang berkesinambungan dengan tujuan menjangkau konsumen,"" tulis GoTo.

Pengembangan fitur GoRide Nego dimaksudkan untuk memperluas penawaran produk layanan mobilitas roda dua kepada konsumen dengan memprioritaskan harga.

Kendati demikian, perusahaan belum dapat menjelaskan lebih lanjut terkait mekanisme penggunaan fitur GoRide Nego ini.

Baca juga: Aplikasi Gojek Bisa untuk Chatting, Bagaimana Caranya?

Fitur tarif nego inDrive

Fitur tarif nego yang tengah dikembangkan Gojek bukan pertama kali dicetuskan.

Sebelumnya, inDrive, apliaksi transportasi online juga pernah meluncurkan fitur di mana mitra dan konsumen dapat saling menegosiasikan tarif yang disepakati.

Hal itu disampaikan Director of Ride-Hailing (APAC) inDrive Roman Ermoshin dalam acara rebranding inDrive pada 2022.

""inDrive meyakini bahwa harga wajar adalah yang dapat dinegosiasikan oleh pelanggan secara langsung. Hal ini menjadi misi inDrive dalam menciptakan harga wajar kepada para pelanggan di berbagai negara di seluruh dunia,"" terangnya, dilansir dari Kompas.com (11/10/2022).

Menurutnya, fitur negosiasi tersebut dapat memberikan harga wajar bagi pengguna inDrive.

""Di inDrive, kami meyakini bahwa pengguna dapat selalu bernegosiasi secara langsung. Prinsip people to people akan tetap tidak berubah dan kini tercermin dalam slogan perusahaan, People Driven,"" tandas dia.

Baca juga: GoTo Akan Bagikan Saham Gratis ke Driver, Ini Kriteria Penerima dan Besarannya"
"Driver Gojek Bisa Nilai Penumpang, Ini Risiko Rating yang Buruk",Kompas.com,https://www.kompas.com/tren/read/2023/12/13/070000665/driver-gojek-bisa-nilai-penumpang-ini-risiko-rating-yang-buruk,13/12/2023,"KOMPAS.com - Sebuah unggahan yang menyatakan penumpang ojek online (ojol) bisa mendapat rating atau nilai yang buruk beredar di media sosial.

Unggahan tersebut dibagikan oleh pemilik akun X (dulu Twitter) @thiranosaurusss, Senin (11/12/2023).

Warganet tersebut bercerita, dia melihat driver Gojeknya memberikan nilai bintang dua kepadanya.

""Fak w baru tau driver gojek bisa rate pelanggan tadi w dikasi bintang 2,"" tulisnya.

Hingga Rabu (13/12/2023), unggahan tersebut tayang sebanyak 902.200 kali, disukai 10.000 warganet, dan dibagikan 1.000 kali.

Lalu, benarkah penumpang Gojek bisa mendapat rating buruk? Apa risikonya?

Baca juga: Ada GoRide dan GoRide Comfort di Aplikasi Gojek, Apa Bedanya?





Rating penumpang Gojek

Vice President Corporate Affairs Gojek, Rubi W Purnomo membenarkan penumpang layanan ojol tersebut bisa mendapatkan rating dari pengemudi.

""Untuk mendukung kenyamanan dan keamanan mitra driver dan customer, sejak 2018 Gojek memiliki fitur rating customer,"" ujarnya kepada Kompas.com, Selasa (12/12/2023).

Rubi menjelaskan, aplikasi Gojek memiliki fitur rating penumpang dari pengemudi, bersamaan dengan fitur rating mitra driver yang berasal dari penilaian oleh penumpang.

""Hingga saat ini, fitur ini bersama dengan fitur rating mitra driver telah menjadi bagian di dalam aplikasi Gojek,"" tambahnya.

Menurut dia, penambahan fitur ini dapat digunakan oleh mitra pengemudi dan pelanggan untuk memberikan masukan dua arah kepada pihak Gojek.

Pihaknya mengimbau penumpang dan mitra pengemudi diharapkan memberikan penilaian yang jujur sesuai dengan pengalaman selama menggunakan layanan Gojek.

Meski begitu, Rubi tidak bersedia menjelaskan rincian sanksi yang akan diterima oleh penumpang yang mendapatkan rating buruk dari pengemudi Gojek.

Baca juga: Gojek Uji Coba Fitur GoRide Nego, Apa Itu?

Pengguna Gojek bisa kehilangan akun

SHUTTERSTOCK/WISELY Ilustrasi akun aplikasi Gojek. Ilustrasi akun aplikasi Gojek.

Di sisi lain, dikutip dari situs resminya , Gojek menyatakan pengguna aplikasi tersebut dapat kehilangan akses atas akunnya jika melanggar peraturan yang berlaku.

Akses terhadap akun Gojek akan hilang jika pengguna melakukan pelecehan, aksi diskriminasi, dan aksi kecurangan yang tidak ditoleransi karena tidak menyebarkan dampak sosial yang positif."
"Warganet Mengeluh Sulit Dapat Driver Ojol Jelang Lebaran, Gojek dan Grab Buka Suara",Kompas.com​,https://www.kompas.com/tren/read/2024/04/06/093000165/warganet-mengeluh-sulit-dapat-driver-ojol-jelang-lebaran-gojek-dan-grab,06/04/2024,"KOMPAS.com - Media sosial X (sebelumnya Twitter) diramaikan dengan banyaknya keluhan warganet yang sulit mendapatkan driver ojek online (ojol) dari Gojek dan Grab, menjelang Lebaran 2024, sejak Rabu (3/5/2024).

Kebanyakan warganet tersebut mengeluh, memerlukan waktu cukup lama hingga akhirnya bisa dijemput driver ojol untuk sampai ke tempat tujuannya, atau sekadar mengirim barang.

Tak sampai di situ, beberapa warganet mendapatkan cerita dari driver ojol yang terpaksa menonaktifkan atau mematikan aplikasinya karena diarahkan untuk menjemput penumpang yang titik lokasinya cukup jauh.

Berikut sejumlah keluhan warganet mengenai sulitnya mendapatkan driver ojol Gojek dan Grab:

“Kalian ngerasa gak beberapa hari ini susah banget dapet gojek/grab?” tulis @****rniawan_ pada Kamis (4/4/2024).

""Parah nih gojek sama grab. Applikasinya ngaco kata abang nya… sekarang kalau ada order di blast, dapet nya jauh-jauh buat justify surcharge. Padahal abang nya gak dapet banyak,"" tambahnya.

“#gojek error ya min? 30mnt ga nongol-nongol drivernya,” tulis @*****najah1234 pada Selasa (2/4/2024).

“Sumpa mau plg aja susah bgt ini 30 menit ga nyantol2 driver pdhl keliatannya ada banyak driverr, sekalinya coba grab trs dapet eh abangnya jauh bgt,” tulis @******sbae pada Sabtu (5/4/2024).

Lantas, mengapa driver ojol susah didapat menjelang libur Lebaran 2024?

Baca juga: Kemenaker Sebut Ojol Berhak Dapat THR, Ini Kata Grab dan Gojek

Penjelasan Gojek

SVP Corporate Affairs Gojek Rubi W. Purnomo mengatakan, sulitnya mendapatkan driver ojol dikarenakan sebagian mitra perusahaan ojol ini sudah pulang ke kampung halamannya.

“Jelang Idul Fitri, banyak masyarakat merayakan dengan (berkumpul dengan) keluarga dan kerabat di kampung halaman. Demikian juga sebagian mitra Gojek, Saat ini sedang merayakan momen istimewa tersebut,” ujar Rubi, saat dihubungi Kompas.com, Jumat (5/4/2024).

Agar bisa mendapatkan driver ojol tepat waktu, Rubi mengimbau kepada pelanggan untuk mengalokasikan waktu tambahan saat memesannya, terlebih pada jam-jam sibuk.

Disinggung soal kenaikan tarif ojol, Rubi menyampaikan pada jam-jam sibuk, tarif layanan pun juga akan berubah, menyesuaikan banyaknya permintaan layanan.

Pada saat permintaan tinggi, nantinya pelanggan bisa dikenakan tarif yang sedikit lebih tinggi seperti yang dapat dilihat di termometer kecil di halaman pemesanan dalam aplikasi.

Namun, pihaknya memastikan bahwa harga yang tertera tersebut tetap mengikuti harga batas atas dan batas bawah yang telah diatur oleh pemerintah."
"Penumpang Disebut Harus Bayar Biaya Tambahan Agar Cepat Dapat ""Driver"" Ojol, Ini Kata Gojek",Kompas.com​,https://www.kompas.com/tren/read/2024/12/25/060000965/penumpang-disebut-harus-bayar-biaya-tambahan-agar-cepat-dapat-driver-ojol?page=all,25/12/2024,"KOMPAS.com - Lini masa media sosial X, dulunya Twitter ramai membahas soal penumpang ojek online (ojol), Gojek yang harus membayar biaya tambahan untuk mendapat driver dengan cepat.

Informasi itu diunggah oleh @tanyakanrl pada Minggu (22/12/2024).

""Baru tiba lagi di Indonesia tercinta dan kaget liat ojol sekarang buat dapat driver pun harus bayar? Bukannya udah tugas aplikasinya nyariin kita driver cepet cepet yak? Wkwkwk,"" tulis pengunggah.

Sejumlah warganet pengguna Gojek juga turut menyayangkan kebijakan tersebut. Melalui kolom komentar mereka mengeluhkan dan mengaku masih sulit mendapat driver meski membayar biaya tambahan.

""Pake pencarian cepat pun percuma n***. Apalagi kalau situasinya lagi hujan. Kalaupun udah ada driver yang akhirnya nyangkut, driver-nya bisa skip orderan kita, tanpa chat apa-apa,"" tulis ha**********.

Lantas, benarkah Gojek menarik biaya tambahan agar penumpang bisa mendapat driver dengan cepat?

Baca juga: Cara Cek Pengeluaran di Gojek Selama Setahun, Unduh Gojek Wrapped 2024 di Sini

Penjelasan Gojek

Head of Corporate Affairs Gojek, Rosel Lavina membenarkan bahwa pihaknya menarik biaya tambahan agar penumpang bisa mendapat driver dengan cepat.

Layanan itu disebut dengan fitur ""Pencarian Cepat"".

Fitur ""Pencarian Cepat"" adalah fitur yang memprioritaskan pesanan agar mendapatkan driver lebih dahulu dibanding pemesan lain lewat pendapatan yang lebih tinggi bagi mitra pengemudi.

Rosel menegaskan, fitur tersebut hanya pilihan, boleh digunakan atau tidak oleh penumpang.

""Pencarian Cepat hanya sebagai opsi tambahan yang memungkinkan pelanggan berpeluang untuk mendapatkan mitra driver lebih cepat dibandingkan dengan pemesanan lainnya,"" kata dia, saat dikonfirmasi Kompas.com, Senin (23/12/2024) malam.

Ia menjelaskan, fitur ""Pencarian Cepat"" bersifat opsional dan tidak otomatis diaktifkan. Fitur tersebut hanya aktif jika pengguna mengaktifkannya untuk setiap perjalanan.

Untuk mengaktifkan fitur ini, pengguna cukup mengaktifkan tombol ""Pencarian Cepat"" pada halaman pemesanan setiap kali ingin menggunakannya.

Dalam hal driver membatalkan pesanan pengguna fitur ""Pencarian Cepat"", maka pihak Gojek akan tetap memprioritaskan pemesanan tersebut.

Baca juga: Ramai soal Driver Gojek Tambah Tarif Parkir dan Tol di Luar Tarif Sebenarnya, Apa Solusinya?

Biaya fitur Pencarian Cepat Gojek

Adapun biaya tambahan fitur ""Pencarian Cepat"" tidak selalu sama.

Rosel mengatakan besaran biaya tambahan fitur ""Pencarian Cepat"" ini ditentukan oleh jam pemesanan serta jarak perjalanan.

Jika pengguna tiba-tiba mengganti tujuan, ada kemungkinan berpengaruh terhadap biaya layanan fitur ""Pencarian Cepat"".

Nantinya, pengguna akan membayar jika pemesanan menggunakan fitur ""Pencarian Cepat"" sudah selesai.

Baca juga: 8 Korban Kecelakaan Bus dan Truk di Tol Malang Butuh Tindakan Operasi

Diluncurkan sebagai penghasilan tambahan mitra driver

Fitur ""Pencarian Cepat"" diluncurkan oleh Gojek sejak awal Desember 2024.

Menurut Rosel, tujuan diluncurkannya fitur tersebut adalah untuk menambah penghasilan mitra driver.

""Hadirnya fitur ini juga menjadi potensi pendapatan tambahan bagi mitra driver,"" ucapnya.

Pengguna bisa memanfaatkan fitur Pencarian Cepat untuk seluruh layanan Gojek, seperti GoCar Hemat, GoCar Comfort, GoCar Luxe, GoCar XL, GoCar Prioritas.

Atau bisa juga untuk layanan GoRide, termasuk termasuk GoRide Hemat & GoRide Comfort.

Inovasi fitur ""Pencarian Cepat"" juga menjadi wujud komitmen Gojek untuk terus menghadirkan pengalaman bermobilitas terbaik, termasuk bagi pelanggan kami yang ingin mendapatkan peluang lebih besar untuk mendapatkan driver dengan lebih cepat sesuai kebutuhan mereka.

Di saat yang sama, Gojek tetap memberikan keleluasaan bagi pelanggan untuk memilih opsi pencarian reguler tanpa biaya tambahan."
"Gojek, Grab, dan Maxim Buka Suara soal Potongan Biaya Aplikasi 30 Persen",Kompas.com,https://www.kompas.com/tren/read/2025/01/18/163000165/gojek-grab-dan-maxim-buka-suara-soal-potongan-biaya-aplikasi-30-persen?page=all,18/01/2025,"KOMPAS.com - Pengemudi ojek online (ojol) di Indonesia mengeluhkan adanya potongan biaya di aplikasi yang jumlahnya melebihi 30 persen.

Potongan ini dinilai tidak sesuai dengan Keputusan Menteri Perhubungan Nomor KP 1001 Tahun 2022 Tentang Perubahan Atas Keputusan Menteri Perhubungan Nomor KP 667 Tahun 2022 Tentang Pedoman Perhitungan Biaya Jasa Penggunaan Sepeda Motor Yang Digunakan Untuk Kepentingan Masyarakat Yang Dilakukan Dengan Aplikasi.

Jika merujuk aturan tersebut, biaya potongan aplikasi ojol ditetapkan maksimal 20 persen.

Ketua Umum Asosiasi Pengemudi Ojek Daring Garda Indonesia, Igun Wicaksono mengatakan, fakta di lapangan menunjukkan potongan aplikasi diterapkan di dua perusahaan aplikasi besar sudah melebihi dari 20 persen.

“Sehingga kami sebagai asosiasi menilai perusahaan aplikator sengaja melanggar aturan tersebut,” ujarnya dikutip dari Kompas.com, Selasa (14/1/2025).

Lantas, bagaimana tanggapan dari perusahaan aplikasi ojol di Indonesia?

Baca juga: Cara Cek Pengeluaran di Gojek Selama Setahun, Unduh Gojek Wrapped 2024 di Sini





Tanggapan Gojek terhadap potongan mitra

Head of Corporate Affairs Gojek, Rosel Lavina memastikan komisi yang diterima mitra Gojek tidak lebih dari 15+5 persen dari biaya perjalanan (tarif).

Menurutnya, aturan ini sesuai dengan ketentuan yang telah ditetapkan pemerintah melalui KP 1001/2022 untuk kendaraan roda dua.

Sesuai dengan KP 1001/2022, kata Rosel, 5 persen dari tarif ini dikembalikan untuk menunjang kebutuhan dan membantu pengembangan kapasitas mitra driver, seperti:

Menghadirkan pelatihan keamanan berkendara bagi mitra

Dukungan tim Unit Tanggap Darurat Gojek 24 jam

Fitur keamanan

Pengembangan aplikasi mitra.

Selain itu, untuk program Gojek Swadaya yang memungkinkan mitra driver dapat mengakses berbagai manfaat khusus mulai dari:

Paket pulsa atau internet murah

Perlindungan tambahan

Berbagai voucher diskon yang dapat digunakan untuk membeli kebutuhan sehari-hari dan perawatan kendaraan

Beasiswa untuk anak mitra yang berprestasi.

""Sedangkan, biaya jasa aplikasi yang dibayarkan oleh pelanggan tidak termasuk dalam besaran biaya perjalanan (tarif) yang dipotong dari pendapatan driver,"" kata Rosel kepada Kompas.com, Jumat (17/1/2025).

Menurutnya, biaya jasa aplikasi digunakan mendukung pengembangan produk serta pengalaman pengguna melalui pemeliharaan platform aplikasi, inovasi, hingga diskon untuk pelanggan yang dapat membangun loyalitas, mendorong penggunaan berulang, serta meningkatkan peluang pendapatan mitra driver secara keseluruhan.

Biaya ini, kata Rosel, merupakan praktik yang biasa diterapkan pada industri teknologi.

""Selain itu, pelanggan juga diberikan pilihan untuk menambahkan layanan layanan lainnya yang sepenuhnya menjadi keputusan konsumen, seperti GoGreener (fitur untuk kontribusi mengurangi emisi karbon),"" pungkasnya.

Baca juga: Penumpang Disebut Harus Bayar Biaya Tambahan Agar Cepat Dapat Driver Ojol, Ini Kata Gojek

Respons pihak Grab terkait potongan 30 persen mitra

Chief of Public Affairs, Grab Indonesia, Tirza Munusamy menyampaikan, besaran biaya layanan atau biaya sewa aplikasi yang ditetapkan oleh Grab Indonesia telah sesuai dengan regulasi yang berlaku.

Ketentuan ini sebagaimana yang diatur dalam Keputusan Menteri Perhubungan Nomor 1001 Tahun 2022 tentang Perubahan atas Keputusan Menteri Perhubungan Nomor KP 667 Tahun 2022 mengenai Pedoman Perhitungan Biaya Jasa Penggunaan Sepeda Motor yang Digunakan untuk Kepentingan Masyarakat yang Dilakukan dengan Aplikasi.

""Biaya Layanan tersebut merupakan bentuk bagi hasil antara Grab dan Mitra Pengemudi dalam menyediakan layanan transportasi bagi Konsumen,"" ujarnya terpisah.

Dia menambahkan, sebagian dari biaya layanan ini dikembalikan untuk menunjang kebutuhan dan membantu pengembangan kapasitas Mitra Pengemudi melalui berbagai inisiatif, sebagai berikut:

Dukungan operasional (Layanan Pengaduan GrabSupport 24/7, Tim Cepat Tanggap Kecelakaan 24/7, Pusat Edukasi GrabAcademy, Grab Driver Lounge, Grab Driver Center, Grab Excellence Center, biaya transaksi non-tunai).

Program strategis untuk pengembangan kapasitas Mitra Pengemudi seperti GrabBenefits, Program Beasiswa GrabScholar, Apresiasi Dana Abadi, insentif, Program Kelas Terus Usaha, dan lainnya.

?Asuransi kecelakaan untuk melindungi Mitra Pengemudi.

Baca juga: Cara Melihat Rating Penumpang Gojek dan Grab, Ketahui Risiko Nilai Buruk

Kata pihak Maxim terhadap keresahan pengemudi ojol

Director Development Maxim Indonesia, Dirhamsyah memastikan biaya potongan aplikasi yang dibebankan ke mitra pengemudi sudah sesuai dengan aturan Kementerian Perhubungan.

Dia menyebutkan, Maxim hanya memberikan potongan komisi aplikasi dengan maksimal 15 persen.

“Maxim telah mematuhi peraturan dari pemerintah mengenai biaya potongan aplikasi kepada mitra pengemudi sesuai dengan aturan. Dalam penerapannya kami memberikan komisi potongan sebesar 5-15 persen kepada mitra pengemudi kami dan itu tergantung dengan tarif,” ujarnya dikutip dari Kompas.com, Jumat (17/1/2025).

Selain itu, Dirhamsyah mengatakan, pihaknya juga memberikan kesempatan kepada mitranya untuk mendapatkan pengurangan potongan komisi aplikasi melalui program Pengemudi Branding Prioritas.

“Kami menghormati mitra pengemudi kami untuk mendapatkan penghasilan utama maupun tambahan. Untuk itu melalui Motivation Program for Drivers yang merupakan program khusus yang memungkinkan pengemudi mendapatkan potongan aplikais yang lebih rendah,” kata dia."
Gojek Berevolusi Menjadi Aplikasi Super,Kompas.com​,https://www.kompas.id/artikel/gojek-berevolusi-menjadi-aplikasi-super,27/05/2024,"JAKARTA, KOMPAS - Perusahaan teknologi aplikasi milik Indonesia, Gojek berevolusi menjadi super-app atau aplikasi super bagi ekosistem terintegrasi yang menggerakkan orang, barang, dan uang. Tidak hanya untuk pengguna, Gojek juga menyediakan aplikasi untuk membantu mitra dan merchant yang bekerja sama.

CEO Gojek Group Nadiem Makarim mengatakan, ia tidak pernah menduga Gojek bisa menjadi seperti sekarang. ""Gojek itu menjadi suatu gerakan tersendiri, bukan hanya suatu perusahaan tapi suatu revolusi yang terjadi di bidang teknologi dan kemanusiaan,"" katanya di kantor Gojek, Senin (22/7/2019).

Nadiem bercerita, perusahaan yang didirikannya pada 2010 itu awalnya hanya bermain di bisnis transportasi kendaraan roda dua atau ojek berbasis call center dan laman web. Lima tahun kemudian, Gojek membuat aplikasi ponsel pintar dan meluncurkan tiga layanan selain ojek atau disebut Go-Ride, yaitu layanan pemesanan makanan Go-Food, pengantar barang Go-Send, dan berbelanja Go-Mart.

Pada 2016, Gojek meluncurkan dompet digital Go-Pay dan layanan taksi daring Go-Car. Sejak itu, perusahaan rintisan atau start-up ini mendapat gelar Unicorn karena memiliki valuasi atau bernilai jual hingga 1 miliar dollar AS atau lebih dari Rp 14 triliun.

Tahun ini, Gojek menjadi 20 start-up teratas di dunia yang menyandang status Decacorn karena memiliki valuasi di atas 10 miliar dollar AS atau setara Rp 140 triliun. Menurut survei CBInsights, Gojek menempati urutan ke-18. Sementara, perusahaan serupa yang berbasis di Asia Tenggara, yaitu Grab berada di posisi ke-9 dari 375 start-up berstatus Unicorn di dunia.

Jumlah transaksi Gojek pun tumbuh pesat dalam tiga tahun terakhir. Dari Juni 2016 hingga Juni 2019, jumlah transaksi yang diproses di dalam platform layanan tersebut melesat hingga 1.100 persen atau 12 kali lipat.

""Gojek kini bertransformasi menjadi perusahaan penyedia yang menawarkan berbagai solusi hidup yang lebih mudah, tidak hanya bagi konsumen tetapi juga memperluas akses pendapatan bagi mitra dan peluang pertumbuhan bisnis yang pesat bagi para merchant,"" tutur Nadiem.

Co-Founder Gojek Kevin Aluwi, di acara yang sama mengatakan, komitmen itu diperkuat dengan mengembangkan tiga aplikasi super untuk pengguna, mitra, dan merchant. Aplikasi untuk pengguna kini sudah menyediakan 22 layanan untuk beragam kebutuhan, dari transportasi, pemesanan tiket film, pesan-antar obat, hingga binatu.

Sedangkan, di aplikasi khusus mitra, Kevin mengatakan, mereka menawarkan program bantuan finansial, pinjaman rumah dan kendaraan, hingga bantuan dana umroh. ""Itu bagian kami untuk menyejahterakan mitra pengemudi, sekaligus mendorong mereka agar bisa memberi layanan yang lebih baik ke pelanggan,"" tuturnya.

Baca juga : Ekspansi Go-Jek di ASEAN Semakin Luas

Sementara, untuk aplikasi khusus merchant, Gojek memberi kemudahan bagi pengusaha, khususnya usaha mikro, kecil, dan menengah (UMKM) agar dapat belajar mengembangkan usahanya dan menjangkau pasar yang tidak pernah dijangkau sebelumnya.

""Dengan aplikasi khusus, merchant bisa melakukan berbagai hal, seperti memperbarui menu, hingga membuat promosi,"" kata dia.

Saat ini, aplikasi Gojek telah diunduh lebih dari 155 juta pengguna, dengan lebih dari 2 juta mitra pengemudi, hampir 400.000 mitra merchant, dan 60.000 penyedia layanan di Asia Tenggara.

Logo baru

Pada kesempatan itu, Gojek pun meluncurkan logo baru yang disebut sebagai tanda evolusi Gojek. Logo yang sebelumnya menggunakan simbol pengemudi motor berwarna hijau, diubah dengan simbol seperti huruf O dengan titik hijau di tengah yang lebih sederhana.

Logo baru itu juga memiliki simbol yang lebih universal, kata Nadiem. ""Logo ini melambangkan alasan utama hadirnya Gojek, yaitu memecahkan masalah melalui teknologi. Logo ini melambangkan satu tombol untuk semua,"" ujarnya.

Diminati milenial

Keberagaman layanan yang ditawarkan Gojek diminati banyak pengguna dari kelompok usia milenial. Hal itu terlihat dari hasil penelitian terbaru Alvara Research Center yang berjudul “Perilaku dan Preferensi Konsumen Milenial Indonesia terhadap Aplikasi E-Commerce 2019”.

Penelitian yang dilakukan pada 1.204 responden di lima kota itu menunjukkan, Go-Jek memimpin rata-rata penggunaan pada tiga dari lima sektor aplikasi e-dagang untuk pasar segmen milenial. Sektor tersebut yaitu layanan transportasi, pesan-antar makanan, dan dompet digital.

Sebagai aplikasi layanan transportasi, Go-Jek digunakan oleh 70,4 persen responden, lebih banyak dibanding pengguna layanan transportasi pesaing. Minat konsumen terhadap Go-Jek lebih berkaitan dengan kualitas layanan.

Adapun, menurut mayoritas pengguna aplikasi Pesan Antar Makanan di semua kelompok usia, Go-Food dianggap sebagai pelopor food delivery dan pemimpin pasar layanan antar makanan daring. Hal itu diukur berdasarkan kesadaran akan merek, penggunaan, dan loyalitas konsumen.

Sementara itu, kesadaran pengguna akan layanan Go-Pay mencapai 100 persen di kalangan milenial. Angka ini mengungguli para pemain lain.

CEO dan Founder Alvara Research Hasanuddin Ali mengatakan, momentum dengan para milenial lebih memilih aplikasi e-dagang buatan Indonesia harus dijaga supaya Indonesia bisa menjadi pemain utama di era ekonomi digital dan tidak hanya menjadi pasar.

""Apalagi, berbagai outlook ekonomi menyebutkan bahwa potensi transaksi e-dagang di Indonesia sangat besar,"" kata dia dalam keterangan tertulis."
"Ojek Online dan Kemitraan Semu, Regulasi yang Tertinggal Satu Dekade",kompas,https://www.kompas.id/artikel/ojek-online-dan-kemitraan-semu-regulasi-yang-tertinggal-satu-dekade?status=sukses_login&utm_source=kompasid&utm_medium=login_paywall&utm_campaign=login&utm_content=https://www.kompas.id/artikel/ojek-online-dan-kemitraan-semu-regulasi-yang-tertinggal-satu-dekade&loc=header,17/08/2022,"Ribuan pengemudi ojek online yang tergabung dalam Asosiasi Garda Indonesia menggelar aksi akbar pada 20 Mei 2025 di Jakarta. Aksi ini diwarnai dengan off-bid massal, yaitu penghentian layanan aplikasi secara serentak di seluruh Indonesia, sebagai bentuk protes terhadap potongan pendapatan yang dinilai tidak adil. Para pengemudi menuntut batas potongan maksimal 10 persen, sementara mereka mengklaim saat ini potongan dari aplikator bisa mencapai hampir 50 persen—beban yang berat di tengah pendapatan harian yang rendah. Kondisi ini dinilai bertentangan dengan regulasi pemerintah, seperti Permenhub PM No 12/2019 dan Kepmenhub KP No 1001/2022 (Kompas.com, 19/05).

Gelombang ketidakpuasan ini sebenarnya telah muncul sejak Idul Fitri lalu, ketika para pengemudi juga menuntut tunjangan hari raya (THR). Presiden Prabowo sempat mengimbau platform memberikan bonus hari raya (BHR) sebesar Rp1 juta per pengemudi, yang kemudian diformalkan melalui surat edaran Menteri Ketenagakerjaan. Namun, realisasinya jauh dari ekspektasi, banyak pengemudi hanya menerima Rp 50.000 dan itu pun tidak merata.

Akar masalahnya terletak pada status kemitraan yang selama ini menjadi tameng hukum perusahaan platform. Status ini tidak diatur di UU Nomor 13 Tahun 2003 tentang Ketenagakerjaan dan UU Cipta Kerja. Hal ini seperti membebaskan perusahaan dari kewajiban sebagai pemberi kerja, meskipun mereka tetap mendapatkan manfaat dari kerja para mitra pengemudi. Sejak kemunculan layanan ride-hailing seperti Uber (2014) dan Gojek (2015), relasi kerja dalam ekonomi digital dibiarkan berada di zona abu-abu hukum, tanpa kepastian perlindungan bagi para pekerjanya.

Fenomena ini mencerminkan ketertinggalan regulasi ketenagakerjaan Indonesia dalam merespons dinamika industri digital yang kian dominan. Tanpa reformasi hukum yang memadai, jutaan pekerja gig akan terus berada dalam kondisi kerja yang tidak adil—berkontribusi pada ekonomi nasional, namun tanpa jaminan hak dasar sebagai pekerja.

