judul,penerbit,link,tanggal,content
Koalisi Ojol Nasional Ungkap Dugaan Eksploitasi Pengemudi,kompas,https://video.kompas.com/watch/1849378/koalisi-ojol-nasional-ungkap-dugaan-eksploitasi-pengemudi,26/12/2023,"Kementerian Hak Asasi Manusia (HAM) menggelar audiensi dengan Koalisi Ojol Nasional (KON) pada Kamis (22/5/2025). Pertemuan ini membahas berbagai persoalan yang dialami oleh para pengemudi ojek online di Indonesia.Sekretaris Jenderal KON, Juwel Safriko, menyampaikan sejumlah keluhan terkait ketidakadilan yang kerap dirasakan para pengemudi dalam keseharian mereka.Kami telah menyampaikan banyak hal mengenai perjalanan kami yang sering mengalami ketidakadilan, ujar Juwel.Selain itu, Juwel juga menyoroti dugaan adanya eksploitasi dari pihak aplikasi transportasi online terhadap para pengemudi.Seperti yang kami paparkan tadi, ada beberapa kebijakan dari aplikasi yang membuat kami harus menerima layanan tersebut dalam kondisi yang tidak adil, tambahnya.Simak selengkapnya dalam tayangan berikut ini.Penulis: Siti Laela MalhikmahVideo Jurnalis: Siti Laela MalhikmahProduser: Abba GabrillinVideo Editor: Siti Laela Malhikmah#News #OjekOnline #EkspolitasiOjekOnline ##vjlab"
Ojol URC Jabodetabek Minta Prabowo Buatkan Perppu Pelindungan Ojol,kompas,https://video.kompas.com/watch/1862230/ojol-urc-jabodetabek-minta-prabowo-buatkan-perppu-pelindungan-ojol,17/03/2023,"Ratusan ojek online (ojol) yang tergabung dalam Unit Reaksi Cepat (URC) melayangkan tiga tuntutan, salah satunya kepada Presiden Republik Indonesia, Prabowo Subianto. Dani Stephanus, juru bicara ojol URC mengatakan pihaknya memiliki tiga tuntutan, yaitu menolak status ojol sebagai buruh atau pekerja, menolak potongan sepuluh persen, dan meminta Presiden Prabowo mengeluarkan Peraturan Perundang-undangan (Perpu).Tuntutan kita satu terbitkan Perppu, kemudian tolak mitra jadi pekerja, dan yang ketiga tolak potongan sepuluh persen, ujar Dani kepada Kompas.com pada Kamis (17/7/2025) di Patung Kuda, Jakarta Pusat.Arief, perwakilan ojol Cikarang juga mengatakan demo ojol kali ini berbeda dengan demo ojol lainnya. URC memberikan tiga tuntutan tersebut dikarenakan ada beberapa alasan.Status kita mitra, mitra itu waktunya tidak dibatasi. Nah disini kita lihat, ketika status itu belok. Maka banyaklah jumlah yang bakal dikeluarkan dari ojol sekarang, ujar Arief kepada Kompas.com. Penulis: Siti Laela MalhikmahVideo Jurnalis: Siti Laela MalhikmahProduser: Abba GabrillinVideo Editor: Siti Laela Malhikmah#Ojol #OjekOnline #DemoOjol #Prabowo #News ##vjlab"
"Viral Tren Bule Pakai Jaket Ojol di Bali, Dipakai Buat Jalan Hingga Clubbing",detik,https://wolipop.detik.com/entertainment-news/d-7318272/viral-tren-bule-pakai-jaket-ojol-di-bali-dipakai-buat-jalan-hingga-clubbing,27/09/2024,"Bali dengan segala kelakuan wisatawan asingnya yang 'ajaib' tak pernah kehabisan cerita. Terbaru, tren berjaket ojek di kalangan para pria bule.

Belakangan viral unggahan-unggahan di Tik-Tok yang memperlihatkan segerombolan turis laki-laki mancanegara (terlihat dari tampangnya berasal dari ras Kaukasoid) berkeliaran di jalanan Bali hingga berpesta sambil memakai jaket ojek online (ojol) yang khas dengan warna hijaunya.

Seperti yang muncul di postingan akun @lillacc13. Video para pria bule tampil kompak dengan jaket pengendara motor mitra Grab berjalan kaki itu telah disaksikan 267.200 kali.

ADVERTISEMENT SCROLL TO CONTINUE WITH CONTENT

Hamish Newton-Vesty, content creator pemula asal Australia, juga membuat video tentang fenomena unik tersebut.

ADVERTISEMENT

Ia wawancarai langsung bule-bule yang kegandrungan dengan 'tren' berjaket ojol, lalu mengunggahnya di TikTok dan Instagram.

""Berapa harga yang kalian bayar untuk jaket Gojek,"" tanya Hamish kepada tiga pria bule yang sedang asyik ngebir dan clubbing. Mereka sebenarnya sedang memakai jaket berlogo Grab.

""200.000!"" jawab salah satu pria sampai membuat kaget Hamish.

""Ketika kamu melihat perusahaan seperti ini, kamu pasti akan terlihat keren. Tinggal cari kesempatan. Perhatian orang-orang pasti akan tertuju ke kami,"" kata pria lainnya.

[Gambas:Instagram]







Hamish kemudian bertanya lagi, ""Jadi menurut kalian, apakah dengan jaket ini kalian bisa memikat para wanita?""

""Kalau saya bilang tidak, mungkin terdengar bodoh,"" balas bule lainnya.

Kepada Wolipop, Hamish mengatakan wawancara tersebut terjadi sekitar beberapa bulan lalu di kawasan Canggu.

""Hari berikutnya saya melihat grup yang terdiri dari empat pria pergi berpesta pakai jaket serupa. Hampir setiap malam pasti kamu akan menemukan seorang turis memakai jaket itu,"" tambahnya.

Wolipop sudah meminta tanggapan dari Grab terkait unggahan viral tersebut. Namun, Grab belum dapat memberikan respons."
"Skema dan algoritma GoJek cs yang kian ""mencekik"" mitra ojol",alinea.id,https://www.alinea.id/peristiwa/skema-dan-algoritma-gojek-cs-yang-kian-mencekik-mitra-ojol-b2npg9RD7,21/08/2024,"Pemerintah saat ini tengah menyusun RUU Transportasi Online dan merevisi UU Ketenagakerjaan demi mengakomodasi tuntutan mitra Gojek cs.

Meskipun terus-menerus diprotes pengemudi ojek online (ojol), skema promo pengguna dan potongan tarif yang tinggi masih diberlakukan penyedia aplikasi ojol. Ketua Serikat Pekerja Angkutan Indonesia (SPAI) Lily Pujiati menyebut masih banyak pengemudi ojol yang melaporkan kehilangan hingga 80% pendapatan mereka karena skema potongan dan promo dari GoJek cs.

Lily mencontohkan salah satu pengemudi yang mendapatkan Rp5.200 untuk layanan pengantaran makanan. Padahal, pengguna aplikasi membayar Rp18.000 untuk layanan itu. Artinya, ada pemotongan hingga 70% dari upah driver.

“Ini jelas tidak adil karena kami tidak mendapatkan bagian 80% dari hasil kerja kami bila mengacu pada aturan pemerintah mengenai potongan platform maksimal 20%,” ujar Lily dalam keterangan pers yang diterima Alinea.id di Jakarta, belum lama ini.

Menurut Lily, hampir semua pengelola aplikasi memberlakukan skema diskriminatif yang bikin pendapatan para mitra anjlok. Di antara lainnya, ia menyebut pemberlakuan level atau tingkatan, slot, Argo Goceng (Aceng), hub, dan GrabBike Hemat.

Jika tak memilih skema prioritas itu, menurut Lliy, pengemudi ojol bakal sulit mendapatkan pesanan. Pendapatan pengemudi ojol kian tergerus karena biaya operasional, semisal parkir, suku cadang, paket data, cicilan atribut, dan perawatan kendaraan.

“Ini semua yang membuat upah kami per bulan hanya Rp 3 juta, tanpa libur di hari Sabtu-Minggu. Ini jauh dari upah minimum DKI Jakarta. Kami adalah pekerja, tapi perusahaan platform seperti Gojek, Grab, Maxim, ShopeeFood, Lalamove, InDrive, Deliveree, Borzo, dan lainnya tidak mengakui kami sebagai pekerja tetap,” kata dia.

Situasi itu dibenarkan Roman--bukan nama sebenarnya. Roman sudah 6 tahun jadi pengemudi GoJek. Ia mengaku pendapatannya turun drastis selama beberapa tahun terakhir karena beragam potongan dan sistem level yang diberlakukan perusahaan aplikasi.

""Kalau balik ke level dasar, susah dapet orderan. Jadi, kita harus jalan terus (menerima pesanan) supaya naek level. Kayak maen Mobile Legends aja. Kalau udah ganti season (musim), turun lagi levelnya. Misalnya, udah mythic, terus balik ke epic,"" tutur Roman saat berbincang dengan Alinea.id di depan sebuah ruko di Jakarta Barat, Ahad (1/6).

GoJek memberlakukan empat level bagi para mitra. Level basic atau dasar adalah level dengan potensi mendapatkan pesanan lebih sedikit. Selain itu, ada level silver, gold, dan platinum. Mitra dengan level yang lebih tinggi biasanya memiliki prioritas dalam mendapatkan orderan.

Menurut Roman, level mitra itu di-reset tiap bulan. ""Kalau sebulan levelnya basic terus, bawa pulang Rp3 juta itu udah bagus banget. Kadang-kadang sehari cuma dapet dua atau tiga (pesanan). Cukup buat beli bensin doang,"" kata pemuda berusia 29 tahun itu.

Hasrat pindah profesi, kata Roman, berulang kali terlintas di benaknya. Namun, Roman masih gamang. Apalagi, ia hanya mengantongi ijazah SMA.

""Ya, mudah-mudahan sih pemerintah nyusun aturan yang memihak ke kita. Kan kita juga kerja beneran. Ngasih untung buat perusahaan, buat pemerintah juga kan,"" ujar dia.

Mei lalu, ribuan pengemudi ojol menggelar aksi unjuk rasa besar-besaran menuntut perusahaan dan pemerintah memperhatikan kesejahteraan para mitra Gojek cs. Di antara lainnya, para demonstran mengeluhkan status kemitraan yang merugikan pengemudi serta potongan dari perusahaan aplikasi yang kian mencekik.

Sehari setelah aksi unjuk rasa besar-besaran itu, sebanyak 66 asosiasi pengemudi ojol diundang Komisi V ke Gedung DPR. Usai rapat dengar pendapat, Ketua Komisi V DPR RI Lasarus menyatakan DPR akan segera membahas rancangan undang-undang mengenai angkutan online.



Ekonom dan pakar kebijakan publik dari UPN Veteran Jakarta Achmad Nur Hidayat mengatakan relasi antara pengemudi dan perusahaan platform saat ini mencerminkan ""kemitraan semu."" Perusahaan memiliki kendali sepihak atas seluruh aspek kerja para mitra, mulai dari tarif, jam kerja, hingga sanksi.

“Para pengemudi tidak diakui sebagai pekerja formal, tapi juga tidak diperlakukan sebagai mitra sejati. Mereka tidak mendapat jaminan sosial, asuransi kerja, ataupun perlindungan dari pemutusan hubungan kerja secara sepihak,” ujar Achmad saat dihubungi Alinea.id di Jakarta, belum lama ini.

Lebih jauh, Achmad menyoroti peran algoritma sebagai “majikan tak terlihat” yang menentukan nasib pengemudi tanpa transparansi. Ia menyebut perlunya audit independen dan regulasi yang mengatur keadilan data agar logika mesin tidak menggantikan keadilan manusia.

""Ia menentukan siapa yang mendapat order, berapa penghasilannya, bahkan siapa yang dihukum karena dianggap tidak produktif. Tanpa transparansi, algoritma ini menjadi alat dominasi. Kita butuh mekanisme audit independen atas algoritma dan kebijakan data fairness. Jangan sampai logika mesin menjadi alasan untuk menghilangkan keadilan manusia,"" tutur Achmad.

Sejumlah pengemudi ojek online melintas di kawasan Paledang, Kota Bogor, Jawa Barat, Selasa (15/1)./AntaraFoto

Mencontoh Inggris

Achmad sepakat perlu ada regulasi yang memformalisasi status pekerja para pengemudi ojol. Indonesia, kata dia, bisa mencontoh Inggris yang menetapkan status worker—di mana pengemudi tetap mendapat hak dasar walau bukan pegawai tetap.

""Negara-negara Eropa juga mulai menerapkan prinsip co-regulasi, yakni kebijakan berbasis dialog antara pekerja, perusahaan, dan pemerintah. Ini lebih adil, partisipatif, dan sesuai dengan semangat demokrasi ekonomi,"" kata dia.

Dalam menyusun regulasi, Achmad menekankan agar komunitas ojol dilibatkan secara aktif. ""Negara harus hadir bukan hanya membatasi komisi maksimal dan mengaudit algoritma, tapi juga menciptakan forum dialog permanen yang melibatkan pengemudi, perusahaan, dan pemerintah,"" tuturnya.

Senada, Koordinator bidang advokasi SPAI Raymond Kusnadi meminta perusahaan menghapus status mitra yang melekat pada pengemudi ojol. Ia menyebut status mitra sebagai siasat perusahaan untuk menghindari kewajiban sebagai pemberi kerja.

“Hak-hak kami tidak dipenuhi, baik itu dalam bentuk jaminan upah minimum, jaminan sosial, hak cuti, hingga hak berserikat,” kata Raymond kepada Alinea.id.

Raymond mengapresiasi langkah awal Kementerian Ketenagakerjaan (Kemnaker) dalam memperkenalkan bantuan hari raya (BHR) sebagai bentuk pemenuhan hak pendapatan non-upah bagi pengemudi. Namun, ia menilai bahwa BHR belum sebanding dengan tunjangan hari raya (THR) sesuai regulasi ketenagakerjaan.

“Untuk tahun berikutnya, THR harus ditegaskan sebagai kewajiban platform. Kami juga mendesak agar serikat pekerja terus dilibatkan dalam proses penyusunan RUU Ketenagakerjaan baru,” kata dia."
Ekonom: Kenaikan Tarif Ojol Tak Selalu Diikuti Kesejahteraan Driver,Antara News,https://www.antaranews.com/berita/3066745/ekonom-kenaikan-tarif-ojol-tak-selalu-diikuti-kesejahteraan-driver,28/02/0205,"Ekonom: Kenaikan tarif ojol tak selalu diikuti kesejahteraan driver

Jakarta (ANTARA) - Ekonom Universitas Airlangga (Unair) Rumayya Batubara menilai niat baik pemerintah untuk mensejahterakan pengemudi atau driver ojek online atau ojol melalui kenaikan tarif perlu diapresiasi namun kenaikan tarif ojol tidak selalu berhubungan dengan kesejahteraan driver.

Ia mencontohkan ketika konsumen memilih moda transportasi lain saat tarif ojol tinggi, maka potensi pendapatan driver akan menurun. Hal itu dikarenakan karakter pengguna ojol yang sangat sensitif terhadap harga. Ketika ada perubahan harga, mereka akan mencari alternatif moda transportasi lain, atau bahkan mengurangi mobilitasnya.

""Misalkan jika sebelumnya bisa mendapatkan 10 penumpang, dengan adanya kenaikan ini penumpangnya jadi turun jadi 7 atau bahkan hanya 5. Perlu diingat, jumlah driver tetap sama, tapi penumpang berkurang,"" ujar Rumayya dalam keterangan di Jakarta, Kamis.

Dari sisi konsumen, berdasarkan studi yang dilakukan oleh Research Institute of Socio- Economic Development (RISED), lebih dari 50 persen konsumen pengguna ojol adalah masyarakat menengah bawah dan konsumen memilih menggunakan ojol dikarenakan harganya yang terjangkau.

Apabila kenaikan tarif ojol terlalu tinggi, hal itu bisa menjadikan ojol tidak terjangkau lagi oleh sebagian besar konsumen. Akibatnya, konsumen akan memilih opsi transportasi lain, salah satunya kendaran pribadi, yang akan menimbulkan masalah lain seperti kemacetan lalu lintas.

""Ketika tarif ojol naik di tahun 2019, sebanyak 75 persen konsumen menolak kenaikan harga ojol. Persentase penolakan tersebut tergolong tinggi, meski kenaikan tarif pada saat itu tidak sebesar di tahun 2022 ini. Tahun ini kami memang belum melakukan studi terbaru, tapi kemungkinan besar akan ada lebih dari 75 persen konsumen yang menolak, karena kenaikan tarifnya jauh lebih tinggi,"" kata Rumayya, yang juga merupakan Ketua Tim Peneliti RISED.

Secara keseluruhan, kata Rumayya, kenaikan tarif ojol yang tinggi akan menekan daya beli masyarakat dan turut menaikkan inflasi. Terlebih saat ini pemerintah tengah berupaya untuk menekan inflasi melalui program subsidi di berbagai sektor.

""Kita lihat saat ini inflasi sedang tinggi. Bahkan untuk inflasi pangan tertinggi sejak tahun 2015. Jika inflasi tinggi, maka daya beli konsumen tergerus,"" ujar Rumayya.

Kementerian Perhubungan (Kemenhub) sendiri menunda pemberlakuan tarif baru ojek online (ojol) dari seharusnya 15 Agustus 2022 menjadi 30 Agustus 2022. Menurut Rumahyya, perpanjangan waktu tersebut dapat menjadi momentum bagi Kemenhub dalam menjaring masukan dari para pemangku kepentingan dalam menetapkan tarif baru ojol.

""Penundaan pemberlakukan ini bagus walaupun tambahannya hanya 15 hari. Sehingga ada waktu lebih panjang, untuk menghitung lagi dampaknya, dan apakah ada solusi yang lebih baik. Jika memang harus naik, maka berapa besaran tarif yang sesuai. Jadi perpanjangan waktu ini bisa digunakan untuk mencari masukan dan tambahan data agar bisa mengambil kebijakan publik lebih tepat, kami sangat dukung untuk itu,"" kata Rumayya.

Baca juga: Kemenhub tunda pemberlakuan tarif baru ojek daring

Baca juga: Ekonom nilai kenaikan tarif ojol sebaiknya dilakukan secara moderat

Pewarta: Citro Atmoko

Editor: Budi Suyanto

Copyright © ANTARA 2022

Dilarang keras mengambil konten, melakukan crawling atau pengindeksan otomatis untuk AI di situs web ini tanpa izin tertulis dari Kantor Berita ANTARA."
Survei: Mayoritas Pengguna Tetap Pakai Ojol Meski Tarif Naik,Antara News,https://www.antaranews.com/berita/3111405/survei-mayoritas-pengguna-tetap-pakai-ojol-meski-tarif-naik#google_vignette,26/02/2025,"Survei: Mayoritas pengguna tetap pakai ojol meski tarif naik

Ini menunjukkan bahwa betapa tergantungnya masyarakat urban dengan transportasi ojek online

Jakarta (ANTARA) - Hasil survei Polling Institute mencatat sebanyak 29,1 persen pengguna ojek online (ojol) akan tetap memakai ojol, meski tarifnya naik menyusul kenaikan harga bahan bakar minyak (BBM).

Direktur Eksekutif Polling Institute Kennedy Muslim dalam paparannya secara daring di Jakarta, Minggu, menjelaskan bahwa pilihan untuk tetap menggunakan ojol sebagaimana biasanya itu jadi opsi utama, disusul oleh opsi untuk menggunakan sepeda motor pribadi.

""Opsi untuk tetap menggunakan ojol sebagaimana biasanya itu memang tertinggi, ada 29,1 persen. Ini menunjukkan bahwa betapa tergantungnya masyarakat urban dengan transportasi ojek online,"" katanya.

Respons tertinggi kedua jika kenaikan tarif ojol diberlakukan, lanjut Kennedy, adalah menggunakan sepeda motor pribadi sebanyak 26,6 persen diikuti tetap menggunakan ojol dan kombinasi motor sendiri sebesar 14 persen, menggunakan motor sendiri/angkutan umum 5,3 persen, atau menggunakan angkutan

umum 5,3 persen.

""Memang kita melihat mereka yang beralih ke angkutan umum masih sangat kecil, rata-rata di bawah enam persen,"" katanya.

Lebih lanjut, Kennedy mengemukakan kenaikan tarif ojol juga mengancam mitra ojol itu sendiri. Misalnya, dengan kenaikan tarif sebesar Rp2.000 per perjalanan, sekitar 25 persen pengguna mundur dan beralih ke moda lain.

Adapun jika kenaikan tarif mencapai sekitar Rp4.000 per perjalanan, maka kemungkinan ada sekitar 72 persen pengguna yang tidak akan menggunakan ojol lagi.

Oleh karena itu, meski mayoritas mitra driver setuju/sangat setuju dengan kenaikan tarif, namun demikian konsekuensi logis sebagai dampak kenaikan tarif mendapat respons yang sangat bertolak belakang oleh mitra driver.

""Mayoritas cenderung menitikberatkan pada volume order yang tidak berkurang tanpa ada kenaikan tarif, 53,1 persen. Atau bahkan cukup besar kalangan mitra yang lebih menginginkan tarif diturunkan agar order lebih banyak, 21,1 persen,"" katanya.

Kennedy menuturkan kenaikan harga BBM kemungkinan akan menjadi faktor peredam pergeseran para pengguna ojol ke moda transportasi lain, terutama kendaraan pribadi, akibat kenaikan tarif ojol.

Dengan kenaikan harga BBM pada kisaran yang kurang lebih sama, sekitar Rp2.000/liter, sehingga harga per liter BBM subsidi menjadi setara dengan harga rata-rata tarif minimum ojol.

""Ini akan menjadi pertimbangan serius bagi pengguna, terutama kelompok-kelompok yang lebih cenderung tetap menggunakan ojol meski mengalami kenaikan tarif (secara umum kelompok ini ada sekitar 29 persen), yaitu kelompok perempuan, usia 31 tahun ke atas, pendapatan semakin tinggi, dan terutama yang semakin intens dalam penggunaan ojol,"" katanya.

Kennedy juga mengungkapkan jika diasumsikan pola preferensi umum tersebut berlaku konstan terhadap pengguna yang cenderung beralih ke motor pribadi, maka kenaikan harga BBM paling tidak akan mengurungkan niat sekitar 7-8 persen pengguna ojol yang akan beralih menggunakan motor pribadinya.

Survei Polling Institute bertajuk ""Kenaikan Tarif Ojek Online di Mata Pengguna dan Pengemudi"" itu dilakukan dalam periode 16-24 Agustus 2022 lalu. Oleh karena survei dilakukan sebelum kenaikan tarif ojol, maka survei diharapkan bisa memotret persepsi masyarakat sebelum kenaikan tarif.

Populasi survei tersebut adalah warga yang berumur 17 tahun atau lebih, atau sudah menikah dan merupakan pengguna ojek online yang pernah bepergian minimal satu hari dalam seminggu terakhir (atau mitra driver) ojek online berbasis aplikasi.

Dari populasi itu dipilih secara random (multistage random sampling) dengan sample basis sebanyak 1.030 responden yang tersebar secara proporsional di 31 kabupaten/kota, kemudian dilakukan oversample sebanyak 190 responden pada kelompok pengguna rutin ojek online, sehingga total sample yang dianalisis sebanyak 1.220 responden.

Sementara margin of error dari ukuran sampel basis tersebut sebesar +/- 3,1 persen pada tingkat kepercayaan 95 persen (dengan asumsi simple random sampling).

Sedangkan sampel mitra driver dipilih secara random (multistage random sampling) sebanyak 810 responden dengan margin of error sampel sekitar +/- 3,5 persen pada tingkat kepercayaan 95 persen (dengan asumsi simple random sampling).

Baca juga: Pengamat: Revisi tarif ojol tepat, biaya aplikasi bisa berdampak luas

Baca juga: Mulai Sabtu, Kemenhub resmi sesuaikan tarif ojek online

Baca juga: Grab patuhi keputusan kenaikan tarif ojek ""online""

Pewarta: Ade Irma Junida

Editor: Kelik Dewanto

Copyright © ANTARA 2022

Dilarang keras mengambil konten, melakukan crawling atau pengindeksan otomatis untuk AI di situs web ini tanpa izin tertulis dari Kantor Berita ANTARA."
Gojek kembangkan fitur dengan teknologi terkini untuk beri rasa aman,ANTARA News,https://www.antaranews.com/berita/4050564/gojek-kembangkan-fitur-dengan-teknologi-terkini-untuk-beri-rasa-aman,08/04/2024,"Gojek kembangkan fitur dengan teknologi terkini untuk beri rasa aman

Jakarta (ANTARA) - Gojek, penyedia layanan on-demand services milik Grup GoTo, berupaya memberikan rasa aman kepada pelanggannya dengan mengembangkan berbagai fitur keamanan menggunakan teknologi terkini, seperti fitur Bagikan Perjalanan dan Tombol Darurat.

“Bagi Gojek, keamanan dan keselamatan adalah prioritas utama. Prioritas tersebut kami tunjukkan dengan pemanfaatan teknologi terkini untuk memberikan rasa aman saat menggunakan aplikasi Gojek,” kata SVP Corporate Affairs Gojek Rubi Purnomo dalam pernyataannya di Jakarta, Senin.

Pihaknya juga berupaya untuk menerapkan langkah proteksi tambahan serta memberikan edukasi berkelanjutan kepada pelanggan dan mitra pengendara (driver) untuk menciptakan budaya aman dalam ekosistem Gojek, terutama menjelang libur Idul Fitri yang berpotensi mendorong tingginya mobilitas masyarakat.

Ia menuturkan bahwa pengguna dapat menggunakan fitur “Bagikan Perjalanan” untuk membagikan informasi terkait lokasi penjemputan dan pengantaran, pengendara dan kendaraannya, status perjalanan dan estimasi waktu tempuh, hingga jalur yang dipilih pengendara dalam perjalanannya kepada kerabat pengguna.



Baca juga: Menhub RI teteskan air mata dengar kisah anak mitra Gojek lulus kuliah



Baca juga: Gojek gandeng BRI berikan mudik gratis bagi mitra pengemudi

Sementara fitur “Tombol Darurat” dapat dimanfaatkan oleh pelanggan maupun mitra driver untuk terhubung dengan Unit Darurat Gojek 24 Jam jika terjadi keadaan darurat. Unit tersebut juga menyiagakan layanan ambulans.

Rubi mengatakan bahwa pihaknya juga menyediakan asuransi dasar untuk meminimalisir dampak risiko selama perjalanan.

Di luar asuransi dasar tersebut, sebelum memulai perjalanan, pelanggan juga dapat mengaktifkan perlindungan tambahan ‘PerjalananAman+’ hingga Rp350 juta.

Ia menuturkan bahwa pihaknya pun menghadirkan fitur Verifikasi Muka mitra pengendara dan penyamaran nomor telepon (number masking) untuk memastikan kesesuaian identitas dan kendaraan mitra driver Gojek serta kenyamanan masyarakat saat berkomunikasi dengan mitra.

“Pengguna bisa mempelajari perangkat keamanan layanan transportasi Gojek yang akan muncul bahkan sejak pemesanan baru dibuat. Langkah ini bisa dipelajari dan digunakan dengan mengklik Tombol Perangkat Keamanan Gojek berbentuk perisai hijau di halaman perjalanan,” ujarnya.



Baca juga: Jelang Lebaran, GoSend perkuat layanan dengan ragam fitur baru



Baca juga: Gojek dan GoPay ajak masyarakat berbagi kebaikan di bulan Ramadhan



Pewarta: Uyu Septiyati Liman

Editor: Zita Meirina

Copyright © ANTARA 2024

Dilarang keras mengambil konten, melakukan crawling atau pengindeksan otomatis untuk AI di situs web ini tanpa izin tertulis dari Kantor Berita ANTARA."
Ekonom meminta pemerintah hati-hati soal kenaikan tarif ojol,Antara News,https://www.antaranews.com/berita/4936037/ekonom-minta-pemerintah-hati-hati-soal-kenaikan-tarif-ojol,02/07/2025,"Ekonom minta pemerintah hati-hati soal kenaikan tarif ojol

Jakarta (ANTARA) - Ekonom Piter Abdullah meminta pemerintah untuk mengedepankan kehati-hatian sebelum memutuskan kenaikan tarif ojek daring/online (ojol) sebesar 8-15 persen.

Piter dalam keterangannya di Jakarta, Selasa, menilai kebijakan tersebut belum tentu memberikan keuntungan bagi pengemudi maupun industri, serta memiliki risiko penurunan minat pengguna terhadap layanan jasa berbasis aplikasi ini.

“Kenaikan tarif harus jelas tujuannya. Untuk siapa kenaikan ini? Jika membebani penumpang, tapi tidak menjamin pendapatan pengemudi naik, maka itu bukan kebijakan yang bijak,” ujar Piter.

Ia mengingatkan, baik kenaikan maupun penurunan tarif memiliki dampak yang perlu dikaji secara menyeluruh.

Menurunkan tarif, lanjut Piter, bisa merugikan pengemudi, sementara menaikkan tarif bisa mengurangi jumlah penumpang, yang ujungnya juga menurunkan omzet pengemudi dan perusahaan aplikasi.

Piter pun mendorong agar pemerintah lebih berhati-hati dan menyusun kebijakan berbasis kebutuhan serta kajian yang objektif, bukan sekadar menyesuaikan permintaan salah satu pihak.

Sebelumnya, Direktur Jenderal Perhubungan Darat Kementerian Perhubungan (Kemenhub) Aan Suhanan mengatakan kajian terkait kenaikan tarif ojol sebesar 8-15 persen sudah memasuki tahapan final.

“Untuk tuntutan terkait dengan tarif, kami sudah melakukan pengkajian dan sudah final untuk perubahan tarif, terutama roda dua, itu ada beberapa kenaikan,” kata Aan dalam Rapat Kerja (Raker) bersama Komisi V DPR RI di Kompleks Parlemen Senayan, Jakarta, Senin (30/6).

Finalisasi kenaikan tarif tersebut, lanjut Aan, dibuat berdasarkan kajian mendalam dan terus-menerus. Nantinya, kenaikan tarif akan bervariasi, tergantung zona masing-masing pengguna.

“Ini yang sudah kami buat, kami kaji, sesuai dengan zona yang sudah ditetapkan. Ada bervariasi, kenaikan tersebut ada 15 persen, ada 8 persen, tergantung dari tiga zona yang kita tetapkan,” ujar dia.

Baca juga: Kemenhub sebut kajian kenaikan tarif ojol memasuki tahap final

Baca juga: Wamenhub: Perlu terobosan hukum untuk atasi permasalahan ojol

Baca juga: Grab jelaskan penerapan potongan tarif aplikasi 20 persen kepada mitra

Pewarta: Arnidhya Nur Zhafira

Editor: Biqwanto Situmorang

Copyright © ANTARA 2025

